<?xml version="1.0" encoding="utf-8"?>

<!DOCTYPE excursions_catalog SYSTEM "excursions_catalog.dtd">

<excursions_catalog>
    <excursions>
        <excursion>
            <basic_info>
                <code>ExcursionParis1</code>
                <category>Европа</category>
                <name>Парижка магия</name>
                <towns>Париж</towns>
                <price>1000 лева</price>
                <type>Самолет</type>
            </basic_info>
            <secondary_info>
                <route></route>
            </secondary_info> 
            <conditions>
                <enrollmentConditions></enrollmentConditions>
            </conditions>
    </excursion>
    </excursions>
</excursions_catalog>